{
  "schemaVersion": 1,
  "generatedAt": "2026-07-23T11:30:20.876Z",
  "tool": "galaxy-lint@0.1.0",
  "analyzer": "sc2-galaxy-lang@1.0.0",
  "files": 2,
  "diagnostics": [
    {
      "file": "src/projects/cmre-porting/runtime/LibPortingObserver.galaxy",
      "line": 21,
      "column": 18,
      "severity": "suggestion",
      "code": "G000",
      "message": "'lv_total' variable is defined but never used.",
      "source": "sc2-galaxy-lang.checker"
    }
  ],
  "summary": {
    "errors": 0,
    "warnings": 0,
    "suggestions": 1,
    "total": 1
  }
}
